{"classification":"same_author_static_contract_validation_no_release_execution","command_contract":"uv run --frozen --extra pilot python scripts/validate_release_lineage_contract.py --compact","contract_schema_sha256":"c26db8f180f6373eb9e974411726d6e2852e51787acc89c46d71c829e39f9c2f","contract_sha256":"6a20d33ed4b7ca4e80ca275e982ab9c7e170a3932820e9295c2dc8674d8c96ed","cryptographic_boundary_checks":{"attestation_bundle_digest_required":true,"exact_byte_sha256_required":true,"git_oid_distinct_from_artifact_sha256":true,"latest_forbidden_as_identity":true,"new_bytes_new_version":true,"policy_digest_required":true,"result_schema_digest_required":true,"self_hash_forbidden":true,"signature_truth_claim_forbidden":true,"software_label_not_execution_identity":true,"stateless_rollback_claim_forbidden":true,"transport_archive_digest_required":true,"trusted_root_digest_required":true},"decision":"NO-GO","errors":[],"lineage_id":"amy-verifiable-release-study-lineage-001","normative_source_count":20,"normative_sources_resolved":true,"parent_link_requirements":{"R0":[],"R1":["R0"],"R2":["R0","R1"]},"read_scope":{"confirmatory_artifacts_read":false,"contract":"protocol/RELEASE_LINEAGE_CONTRACT_DRAFT.json","contract_schema":"schemas/release-lineage-contract.schema.json","independent_review_performed":false,"network_used":false,"source_ledger":"evidence/SOURCE_LEDGER.md","validation_schema":"schemas/release-lineage-validation.schema.json","verifier_results_read":false},"record_status":"draft_not_frozen","release_freeze_permitted":false,"required_identity_field_count":18,"schema_version":"amy.release-lineage-validation.v1-draft","software_component_status":{"A.M.Y":"unresolved_before_R0","AXIOM":"unresolved_before_R0","Atlas":"unresolved_before_R0"},"source_ledger_sha256":"3009ee06d656e0a705d2cb3eb5cdceda9ede77a81eb68904e3d70d1945dad5ab","stage_status":{"R0":"draft_not_frozen","R1":"not_created","R2":"not_created"},"unresolved_field_count":13,"valid":true,"validation_schema_sha256":"531ff7fd58c37400a9ff35ebae3db7d64135e5dde75d6b19a3f18fd50e4d30c8","validator_sha256":"c0fa346de15b0a6135297d8f89efc2f959cec9a914cfdf4f2a0f7325add7ad92","validity_scope":"internal_contract_consistency_not_release_readiness_or_independent_review","warnings":["Lineage contract is internally checkable but remains draft and NO-GO","Unresolved software identities: A.M.Y, AXIOM, Atlas","Unresolved study toolchain identity: amy-verifiable-release-study","Release stages not created: R1, R2","Lineage state contains 13 explicit unresolved pointers"]}
